{
  "$schema": "https://json-schema.org/draft/2020-12/schema",
  "$id": "creator_os.renderer_equivalence_receipt.v2",
  "title": "Creator OS Renderer Equivalence Receipt v2",
  "type": "object",
  "additionalProperties": false,
  "required": [
    "schema",
    "qualificationId",
    "mediaClass",
    "toolchain",
    "fixture",
    "equivalencePolicy",
    "source",
    "identityOutput",
    "checks",
    "measurements",
    "qcEvidence",
    "qcRegression",
    "status",
    "qualifiedAt",
    "receiptFingerprint"
  ],
  "properties": {
    "schema": {
      "const": "creator_os.renderer_equivalence_receipt.v2"
    },
    "qualificationId": {
      "type": "string",
      "pattern": "^renderer_qualification_[a-f0-9]{24}$"
    },
    "mediaClass": {
      "type": "string",
      "minLength": 1
    },
    "toolchain": {
      "$ref": "#/$defs/toolchain"
    },
    "fixture": {
      "type": "object",
      "additionalProperties": false,
      "required": [
        "fixtureId",
        "kind",
        "inputSha256",
        "deterministicInput"
      ],
      "properties": {
        "fixtureId": {
          "type": "string",
          "pattern": "^control_[a-f0-9]{24}$"
        },
        "kind": {
          "const": "exact_control_bytes"
        },
        "inputSha256": {
          "$ref": "#/$defs/sha256"
        },
        "deterministicInput": {
          "const": true
        }
      }
    },
    "equivalencePolicy": {
      "type": "object",
      "additionalProperties": false,
      "required": [
        "policyId",
        "policyVersion",
        "qualificationScope",
        "crossMachineByteReproducibility",
        "byteIdentityRequired",
        "minimumSsim",
        "maximumDurationDeltaFrames",
        "requiredStreamChecks"
      ],
      "properties": {
        "policyId": {
          "const": "reel_factory.renderer_equivalence"
        },
        "policyVersion": {
          "const": "2.0.0"
        },
        "qualificationScope": {
          "const": "exact_toolchain_and_host"
        },
        "crossMachineByteReproducibility": {
          "const": "not_claimed"
        },
        "byteIdentityRequired": {
          "const": false
        },
        "minimumSsim": {
          "type": "number",
          "minimum": 0.995,
          "maximum": 1
        },
        "maximumDurationDeltaFrames": {
          "const": 1
        },
        "requiredStreamChecks": {
          "type": "array",
          "minItems": 4,
          "uniqueItems": true,
          "items": {
            "enum": [
              "dimensions",
              "frame_rate",
              "duration",
              "audio_policy"
            ]
          }
        }
      }
    },
    "source": {
      "$ref": "#/$defs/mediaIdentity"
    },
    "identityOutput": {
      "$ref": "#/$defs/mediaIdentity"
    },
    "checks": {
      "type": "object",
      "additionalProperties": false,
      "required": [
        "dimensionsEqual",
        "frameRateEqual",
        "durationWithinOneFrame",
        "audioPolicyEqual"
      ],
      "properties": {
        "dimensionsEqual": {
          "type": "boolean"
        },
        "frameRateEqual": {
          "type": "boolean"
        },
        "durationWithinOneFrame": {
          "type": "boolean"
        },
        "audioPolicyEqual": {
          "type": "boolean"
        }
      }
    },
    "measurements": {
      "type": "object",
      "additionalProperties": false,
      "required": [
        "ssim",
        "byteIdentical",
        "durationDeltaSeconds",
        "durationDeltaFrames"
      ],
      "properties": {
        "ssim": {
          "type": "number",
          "minimum": 0,
          "maximum": 1
        },
        "byteIdentical": {
          "type": "boolean"
        },
        "durationDeltaSeconds": {
          "type": "number",
          "minimum": 0
        },
        "durationDeltaFrames": {
          "type": "number",
          "minimum": 0
        }
      }
    },
    "qcEvidence": {
      "type": "object",
      "additionalProperties": false,
      "required": [
        "evaluated",
        "policySha256",
        "baselineReport",
        "identityReport",
        "newBlockingCodes"
      ],
      "properties": {
        "evaluated": {
          "type": "boolean"
        },
        "policySha256": {
          "$ref": "#/$defs/sha256"
        },
        "baselineReport": {
          "oneOf": [
            {
              "$ref": "#/$defs/evidenceFile"
            },
            {
              "type": "null"
            }
          ]
        },
        "identityReport": {
          "oneOf": [
            {
              "$ref": "#/$defs/evidenceFile"
            },
            {
              "type": "null"
            }
          ]
        },
        "newBlockingCodes": {
          "type": "array",
          "uniqueItems": true,
          "items": {
            "type": "string",
            "minLength": 1
          }
        }
      }
    },
    "qcRegression": {
      "type": "boolean"
    },
    "status": {
      "enum": [
        "qualified",
        "failed"
      ]
    },
    "qualifiedAt": {
      "type": "string",
      "format": "date-time"
    },
    "receiptFingerprint": {
      "$ref": "#/$defs/sha256"
    }
  },
  "allOf": [
    {
      "if": {
        "properties": { "status": { "const": "qualified" } },
        "required": ["status"]
      },
      "then": {
        "properties": {
          "checks": {
            "properties": {
              "dimensionsEqual": { "const": true },
              "frameRateEqual": { "const": true },
              "durationWithinOneFrame": { "const": true },
              "audioPolicyEqual": { "const": true }
            }
          },
          "measurements": {
            "properties": {
              "ssim": { "minimum": 0.995 },
              "durationDeltaFrames": { "maximum": 1 }
            }
          },
          "qcEvidence": {
            "properties": {
              "evaluated": { "const": true },
              "baselineReport": { "$ref": "#/$defs/evidenceFile" },
              "identityReport": { "$ref": "#/$defs/evidenceFile" }
            }
          },
          "qcRegression": { "const": false }
        }
      }
    }
  ],
  "$defs": {
    "sha256": {
      "type": "string",
      "pattern": "^[a-f0-9]{64}$"
    },
    "evidenceFile": {
      "type": "object",
      "additionalProperties": false,
      "required": [
        "path",
        "sha256"
      ],
      "properties": {
        "path": {
          "type": "string",
          "minLength": 1
        },
        "sha256": {
          "$ref": "#/$defs/sha256"
        }
      }
    },
    "mediaIdentity": {
      "type": "object",
      "additionalProperties": false,
      "required": [
        "sha256",
        "mediaType",
        "byteSize",
        "width",
        "height",
        "fps",
        "durationSeconds",
        "audioPresent"
      ],
      "properties": {
        "sha256": {
          "$ref": "#/$defs/sha256"
        },
        "mediaType": {
          "enum": [
            "image",
            "video"
          ]
        },
        "byteSize": {
          "type": "integer",
          "minimum": 1
        },
        "width": {
          "type": "integer",
          "minimum": 1
        },
        "height": {
          "type": "integer",
          "minimum": 1
        },
        "fps": {
          "type": [
            "number",
            "null"
          ],
          "exclusiveMinimum": 0
        },
        "durationSeconds": {
          "type": [
            "number",
            "null"
          ],
          "minimum": 0
        },
        "audioPresent": {
          "type": [
            "boolean",
            "null"
          ]
        }
      }
    },
    "executable": {
      "type": "object",
      "additionalProperties": false,
      "required": [
        "path",
        "sha256",
        "version",
        "capabilitiesSha256"
      ],
      "properties": {
        "path": {
          "type": "string",
          "minLength": 1
        },
        "sha256": {
          "$ref": "#/$defs/sha256"
        },
        "version": {
          "type": "string",
          "minLength": 1
        },
        "capabilitiesSha256": {
          "$ref": "#/$defs/sha256"
        }
      }
    },
    "toolchain": {
      "type": "object",
      "additionalProperties": false,
      "required": [
        "repositorySha",
        "rendererImplementationSha256",
        "ffmpeg",
        "ffprobe",
        "fonts",
        "fontsFingerprint",
        "host",
        "hostFingerprint",
        "codecPolicy",
        "codecPolicyFingerprint",
        "encoderSettingsSha256",
        "audioEmbedderSha256",
        "qcPolicySha256",
        "fingerprint"
      ],
      "properties": {
        "repositorySha": {
          "type": "string",
          "minLength": 7
        },
        "rendererImplementationSha256": {
          "$ref": "#/$defs/sha256"
        },
        "ffmpeg": {
          "$ref": "#/$defs/executable"
        },
        "ffprobe": {
          "$ref": "#/$defs/executable"
        },
        "fonts": {
          "type": "array",
          "minItems": 1,
          "uniqueItems": true,
          "items": {
            "type": "object",
            "additionalProperties": false,
            "required": [
              "ref",
              "sha256"
            ],
            "properties": {
              "ref": {
                "type": "string",
                "minLength": 1
              },
              "sha256": {
                "$ref": "#/$defs/sha256"
              }
            }
          }
        },
        "fontsFingerprint": {
          "$ref": "#/$defs/sha256"
        },
        "host": {
          "type": "object",
          "additionalProperties": false,
          "required": [
            "system",
            "release",
            "machine",
            "python",
            "hostInstanceSha256"
          ],
          "properties": {
            "system": {
              "type": "string",
              "minLength": 1
            },
            "release": {
              "type": "string",
              "minLength": 1
            },
            "machine": {
              "type": "string",
              "minLength": 1
            },
            "python": {
              "type": "string",
              "minLength": 1
            },
            "hostInstanceSha256": {
              "$ref": "#/$defs/sha256"
            }
          }
        },
        "hostFingerprint": {
          "$ref": "#/$defs/sha256"
        },
        "codecPolicy": {
          "type": "object",
          "additionalProperties": false,
          "required": [
            "videoCodec",
            "pixelFormat",
            "imageJpegQuality",
            "identityAudioPolicy"
          ],
          "properties": {
            "videoCodec": {
              "const": "libx264"
            },
            "pixelFormat": {
              "const": "yuv420p"
            },
            "imageJpegQuality": {
              "const": 95
            },
            "identityAudioPolicy": {
              "const": "copy_if_present"
            }
          }
        },
        "codecPolicyFingerprint": {
          "$ref": "#/$defs/sha256"
        },
        "encoderSettingsSha256": {
          "$ref": "#/$defs/sha256"
        },
        "audioEmbedderSha256": {
          "$ref": "#/$defs/sha256"
        },
        "qcPolicySha256": {
          "$ref": "#/$defs/sha256"
        },
        "fingerprint": {
          "$ref": "#/$defs/sha256"
        }
      }
    }
  }
}
